ID,CODE,SHORT_DESCRIPTION,LONG_DESCRIPTION,COMMENTS,CREATED_BY_USER_ID,CREATED_DATETIME,MODIFIED_BY_USER_ID,MODIFIED_DATETIME,REF_WADS_PROGRAM_ID,REF_WADS_DEPARTMENT_ID,IS_ACTIVE,IS_MANUAL_ENTRY_ALLOWED
0,0,Not Specified,Not Specified,NULL,0,2011-06-08 10:44:39.0000000,NULL,NULL,0,0,1,1
1,1001,Maritime All Direct Foreign Arrivals,"Record the total number of vessels arriving directly from a foreign port. This includes Vessels from Canada, Vessels that transit the Panama Canal in route between U.S. ports, Vessels on deferred boarding, Ocean going tugs, Yachts, Pleasure boats, Fishing boats, ferry boats, etc. All vessels which meet the above criteria should be counted regardless of whether they were boarded by CBP. (Exclude vessels for bunkers, barges, pilot vessels, local harbor tugs)",NULL,0,2011-12-05 15:24:53.0000000,0,2008-03-10 13:46:22.0000000,1,2,1,1
2,1002,Maritime All Coastwise Arrivals,"Record all foreign origin vessels arriving via a U.S. port.  This includes foreign origin vessels arriving via Hawaii, Puerto Rico, U.S. Virgin Islands, Alaska. This also includes vessels arriving from U.S. mainland ports via Canadian Ports.  Example:  (1) Boston - Halifax - Brooklyn; (2) Seattle - Vancouver - Long Beach.",NULL,0,2011-12-05 15:24:53.0000000,0,2009-10-01 12:45:48.0000000,1,2,1,1
3,1003,Maritime Direct Foreign Ship Inspections,"Record the number of direct foreign commercial vessels boarded and inspected . Include ferry boats, cruise ships, tankers, bulk carriers,  and ocean-going tugs. Do not include vessels listed under code 1005.  Source document is Form 288.",NULL,0,2011-12-05 15:24:53.0000000,0,2009-03-03 09:23:23.0000000,1,2,1,1
4,1004,Maritime Coastwise Ship Inspections,Record the number of coastwise vessels boarded and inspected.  Source document is Form 288.,NULL,0,2011-12-05 15:24:53.0000000,0,2008-03-10 13:48:04.0000000,1,2,1,1
5,1005,Maritime Other Ship Inspections,"Record the number of military, yachts, fishing vessels, historical craft, etc.  Do not include vessels listed under code 1003.  Source document is Form 288.
",NULL,0,2011-12-05 15:24:53.0000000,0,2008-03-10 13:48:35.0000000,1,2,1,1
6,1006,Maritime Ships Monitored For Garbage Control and Seal Checks,"Record spot-check visits to both commercial and non-commercial vessels to assess compliance with garbage regulations and/or seal checks. Source document is Form 288.
",NULL,0,2011-12-05 15:24:53.0000000,0,2008-03-10 13:49:43.0000000,1,2,1,1
10,1017,Maritime Baggage Civil Penalties Passenger/Crew,"Record the number of passenger/crew civil penalties issued, (CBP-AI Form 591).
",NULL,0,2011-12-05 15:24:53.0000000,0,2008-03-10 14:21:06.0000000,1,2,1,1
12,1020,"Treatments, Maritime Cargo, Fumigation ","Report the number of fumigations performed on cargo shipments within the regular hours of service. The source form is APHIS 8030 or 429. Each stack, hence each APHIS 8030/429, counts as one fumigation. If one stack contains 5 B/Ls, it is still only one fumigation.",NULL,0,2011-12-05 15:24:53.0000000,0,2004-03-08 09:31:39.0000000,45,1,1,1
13,1021,"Maritime Cargo/Conveyance Mitigations/Safeguards, Non-Fumigation","Record the number of non-fumigation mitigations/safeguards performed in/on/with cargo or conveyance. Include cleaning/disinfection of conveyances, removing rice straw, washing (steam- cleaning) dirty vehicles, aerosol applications, destroying or re-exporting prohibited commodities such as orange peel, and reconditioning of cargo or violative WPM. (For animal-related treatments, see activity code 1154.)",NULL,0,2011-12-05 15:24:53.0000000,0,2008-03-10 14:24:47.0000000,1,2,1,1
14,1022,"Maritime Garbage Disposal, Entries ",Record the number of garbage removals from vessels. This activity code is paired with activity code 1023.,NULL,0,2011-12-05 15:24:53.0000000,0,2008-03-10 14:30:12.0000000,1,2,1,1
15,1023,"Maritime Garbage Disposal, Weight",Record the weight in kilograms of garbage removed from vessels. Weight on commercial disposal may be obtained from the weight ticket given to the truck driver at the scales when the driver exits from the disposal facility. See code 1022.,NULL,0,2011-12-05 15:24:53.0000000,0,2008-03-10 14:30:33.0000000,1,2,1,1
16,1024,"Maritime Violations, Reported To USCG",Record the number of MARPOL violations reported to the US Coast Guard. Source document is the PPQ 288.,NULL,0,2011-12-05 15:24:53.0000000,0,2008-03-10 14:30:53.0000000,1,2,1,1
18,1030,All Direct Foreign Arrival Aircraft,"Record the total number of all commercial, private, and military direct foreign arriving aircraft, including gas and goes.  Exclude all pre-cleared flights.
",NULL,0,2011-12-05 15:24:53.0000000,0,2008-02-22 12:09:49.0000000,2,2,1,1
19,1031,Commercial Passenger Aircraft Inspections,"Record the number of commercial passenger aircraft in which stores, quarters, and/or holds are physically inspected by CBP agriculture.   
",NULL,0,2011-12-05 15:24:53.0000000,0,2010-10-21 12:57:23.0000000,2,2,1,1
20,1032,Commercial Cargo Aircraft Inspections,"Record the number of commercial cargo aircraft in which stores, quarters, and/or holds are physically inspected by CBP agriculture.
",NULL,0,2011-12-05 15:24:53.0000000,0,2010-10-21 12:57:57.0000000,2,2,1,1
21,1033,"Inspections, Other Aircraft ","Record the number of noncommercial aircraft in which stores, quarters, and/or holds are physically inspected by CBP agriculture.  Include in this category private, corporate, and military aircraft. 
",NULL,0,2011-12-05 15:24:53.0000000,0,2010-10-21 12:59:02.0000000,2,2,1,1
22,1037,Airport QMIs Plant- Baggage,Record the number of plant QMIs intercepted from passenger and/or crew baggage. NOTE: Three different fruits would count as three interceptions out of baggage. Three oranges seized out of the baggage of one passenger would count as one interception.,NULL,0,2011-12-05 15:24:53.0000000,0,2008-02-22 12:24:57.0000000,2,2,1,1
23,1045,Airport Baggage Civil Penalties Passenger/Crew,"Record the number of passenger/crew civil penalties issued, (CBP-AI Form 591).
",NULL,0,2011-12-05 15:24:53.0000000,0,2008-02-22 12:59:53.0000000,2,2,1,1
24,1048,"Treatments, Air Cargo, Fumigation","Report the number fumigations performed on cargo shipments within the regular hours of service. The source form is APHIS 8030 or 429. Each stack, hence each APHIS 8030/429, counts as one fumigation. Note: If one stack contains five airway bills, it is still only one fumigation. A chamber fumigation may contain more than one airway bill, but it is only one fumigation.",NULL,0,2011-12-05 15:24:53.0000000,0,2009-02-25 07:29:11.0000000,45,1,1,1
25,1049,"Airport Cargo/Conveyance Treatments, Non-Fumigation","Record the number of non-fumigation treatments performed in/on/with cargo or conveyance. Include cleaning/disinfection of conveyances, removing rice straw, washing (steam- cleaning) dirty vehicles, aerosol applications, destroying or re-exporting prohibited commodities such as orange peel, and reconditioning of cargo or violative WPM. (For animal-related treatments, see activity code 1154.)
",NULL,0,2011-12-05 15:24:53.0000000,0,2008-02-22 13:06:47.0000000,2,2,1,1
28,1052,Airport Passenger/Crew Secondary Inspections,Record the actual number of passengers / crew referred to secondary for inspection.  Record actual counts only; do not record estimates or formula calculations.,NULL,0,2011-12-05 15:24:53.0000000,0,2008-08-07 07:05:08.0000000,2,2,1,1
30,1060,Land Border Passenger Vehicles Entering,"Record the total number of passenger vehicles entering through land border crossings.  Include POVs, motorcycles, RVs etc. making entry through passenger processing.  DO NOT include commercial truck cargo or other vehicles carrying commercial cargo.
",NULL,0,2011-12-05 15:24:53.0000000,0,2008-03-13 06:12:40.0000000,3,2,1,1
31,1061,"Land Border Pedestrians Entering ","Record the total number of pedestrians entering at the border crossings. 
",NULL,0,2011-12-05 15:24:53.0000000,0,2008-03-13 06:15:55.0000000,3,2,1,1
32,1062,"Land Border Secondary, Vehicles inspected ","Record the number of agricultural inspections performed on vehicles in secondary.
",NULL,0,2011-12-05 15:24:53.0000000,0,2008-03-13 06:19:27.0000000,3,2,1,1
34,1064,Land border pedestrians inspected,Record the number of land border pedestrians  inspected in secondary by agriculture.,NULL,0,2011-12-05 15:24:53.0000000,0,2010-01-26 07:21:26.0000000,3,2,1,1
35,1065,Land Border Freight Railcars Inspected,Record the number of freight railcars physically inspected by agriculture to specifically include exterior inspections and /or interior inspections of empty railcars.  Do not include interior inspections that correspond with contained cargo.  Those inspections will be included with cargo inspections and are recorded under 1067D or 1068D.,NULL,0,2011-12-05 15:24:53.0000000,0,2011-02-15 11:31:19.0000000,3,2,1,1
37,1069,Land Border Civil Penalties Passenger/Pedestrian (CBP-AI Form 591),"Record the number of passenger/pedestrian civil penalties issued.  This would include civil penalties issued to bus and truck drivers for having undeclared prohibited agricultural items for personal use.  Source document is CBP-AI form 591.
",NULL,0,2011-12-05 15:24:53.0000000,0,2008-03-13 06:36:16.0000000,3,2,1,1
43,1083,"Land Border Treatments, Carriers (Other than Rail Cargo)",Record the number of carrier treatments conducted. Do not count rail car cleaning. NOTE; Refusal of a truck carrying produce that was contaminated with soil or manure would count as a treatment.,NULL,0,2011-12-05 15:24:53.0000000,0,2008-03-16 22:23:30.0000000,3,2,1,1
44,1084,"Treatments, Land Border Cargo, Fumigation",Report the number of fumigations conducted on cargo within the regular hours of service. The APHIS 8030 or 429 Form that is filled out for each stack or the chart associated with a chamber fumigation would be the source document for each fumigation.,NULL,0,2011-12-05 15:24:53.0000000,0,2009-02-25 07:38:23.0000000,45,1,1,1
45,1085,"Land Border Treatments, Cargo, Not Fumigated","Record the number of non-fumigation treatments performed in/on/with cargo or conveyance. Include cleaning/disinfection of conveyances, removing rice straw, washing (steam- cleaning) dirty vehicles, aerosol applications, destroying or re-exporting prohibited commodities such as orange peel, and reconditioning of cargo or violative WPM. (For animal-related treatments, see activity code 1154.)
",NULL,0,2011-12-05 15:24:53.0000000,0,2008-03-16 22:24:16.0000000,3,2,1,1
47,1090,"Inspections, Domestic Aircraft ",Report the number of aircraft inspected in pre departure services.,NULL,0,2011-12-05 15:24:53.0000000,0,2003-11-06 15:05:15.0000000,39,1,1,1
48,1091,"Inspections, Domestic Air Passenger/Crew ",Report the number of passenger and crew processed through the airport whether actual physical inspection of their baggage was or was not conducted.,NULL,0,2011-12-05 15:24:53.0000000,0,2004-12-21 09:53:52.0000000,39,1,1,1
49,1092,"Inspections, Regulated Cargo, Airport ",Report by air waybill the number of inspections conducted during regular hours of service on regulated cargo. Includes irradiated and hot water treated commodities.,NULL,0,2011-12-05 15:24:53.0000000,0,2011-08-15 09:24:22.0000000,39,1,1,1
50,1093,"Inspections, Miscellaneous. Cargo, Airport","Report by airway bill the number of inspections of miscellaneous cargo conducted during the regular hours of service. Note: If a regulated item is found during a miscellaneous inspection, that cargo is considered regulated. This is for Pre-Departure cargo only",NULL,0,2011-12-05 15:24:53.0000000,0,2003-11-10 11:26:48.0000000,39,1,1,1
51,1094,"Pre-Clearance Inspections, Aircraft","Record the number of aircraft inspected under the Pre-Clearance program (i.e. Non-US origin including Caribbean islands, Canadian ports, etc.)
",NULL,0,2011-12-05 15:24:53.0000000,0,2008-03-10 09:55:37.0000000,41,2,1,1
52,1102,Cargo Treatments,"Report the number of cargo treatments performed during the regular hours of service. Note: Include cleaning and disinfection of vehicles; removing regulated items; fumigation for export commodities both foreign and to the mainland, etc.",NULL,0,2011-12-05 15:24:53.0000000,0,2003-11-06 14:59:07.0000000,39,1,0,1
53,1103,"Violations, Domestic Mail",Report the number of violations (PPQ518) issued from domestic mail inspections,NULL,0,2011-12-05 15:24:53.0000000,0,2007-04-02 12:10:29.0000000,39,1,1,1
54,1104,Pre-Clearance Civil Penalty Passenger/Crew,"Record the number of passenger/crew civil penalties issued, (CBP-AI Form 591), under the Pre-Clearance program (i.e. Non-US origin including Caribbean islands, Canadian ports, etc.)
",NULL,0,2011-12-05 15:24:53.0000000,0,2008-03-10 10:08:21.0000000,41,2,1,1
55,1110,"Shipments Of Endangered Species ","Report the number of endangered species shipments which arrived from airport, maritime, or land border services and were inspected. A shipment is one bill of lading, airway bill, or the amount carried in baggage with each custom declaration. Each variety does not count as a separate shipment. This code is paired with activity code 1111. Examples include two airway bills of cacti arriving from Mexico; three bills of lading containing orchids plants from Thailand; an entry of cycads arriving by truck at Brownsville.",NULL,0,2011-12-05 15:24:53.0000000,0,2003-04-15 08:59:48.0000000,5,1,1,1
56,1111,"Units Of Endangered Plants ","Report the number of plant units (cuttings, whole plants, propagative units (other than seed)) that were in the endangered species shipments reported under activity code 1110.",NULL,0,2011-12-05 15:24:53.0000000,0,2003-04-15 09:00:16.0000000,5,1,1,1
57,1114,Quarantine-Pest (PIS Only),Report the number of quarantine pests intercepted at the inspection station during the month. Information supplied by identifiers.,NULL,0,2011-12-05 15:24:53.0000000,0,2025-02-22 04:36:40.0000000,5,1,1,1
60,1122,"Certificates, Vs16-4, Animal Byproducts ",Report the number of VS 16-4 forms (Export Certificate - Animal Products) issued.,NULL,0,2011-12-05 15:24:53.0000000,0,2003-04-15 09:07:52.0000000,6,1,1,1
61,1124,"Endangered Plants, Export, Awbs Or B/Ls ",Report the number of endangered species plant shipments inspected for export. Units are AWBs or B/Ls. This code is paired with activity code 1125 and 1125A.,NULL,0,2011-12-05 15:24:53.0000000,0,2009-03-30 07:57:52.0000000,6,1,1,1
62,1125,"Endangered Plants, Units","Report the number of endangered species plant units inspected for export. Note:  If the shipment is dried ginseng, use one as the number of plant units inspected for each shipment being exported.  See code 1124. If other any other gels or preparations can not be individually counted, the unit of measure is 1 for this code.",NULL,0,2011-12-05 15:24:55.0000000,0,2009-11-25 06:49:29.0000000,6,1,1,1
63,1126,Import Shipments W/ Endangered Plant,Report the number of shipments containing parts or derivatives (of plant endangered species) inspected for import. These are nonliving CITES materials.  Inspectional units are airway bills (AWB) or bills of lading (BL) or truck entries. Example would be mahogany lumber.  This code is paired with code 1126A.,NULL,0,2011-12-05 15:24:53.0000000,0,2005-04-27 11:33:21.0000000,9,2,1,1
66,1130,USPS Mail Packages Inspected (including parcel post and express),Record the number of USPS mail packages (parcel post and express) which have been physically opened and inspected for agricultural purposes. Packages that have been x-rayed only are recorded under code 1137.,NULL,0,2011-12-05 15:24:53.0000000,0,2024-04-12 03:37:17.0000000,42,2,1,1
67,1131,USPS Mail Plant QMIs (including parcel post and express),Record the number of plant interceptions from USPS mail inspections (parcel post and express).  Source document is PPQ form 287.,NULL,0,2011-12-05 15:24:53.0000000,0,2024-04-12 03:37:17.0000000,42,2,1,1
70,1134O,USPS Mail QMIs Other Meat Byproducts (including parcel post and express),"USPS Mail Other Animal Byproduct is an agricultural product specifically regulated by 9 CFR; it includes only the inedible animal materials (i.e., not for human consumption).  Record the number of ‘other animal’ byproduct interceptions that are not classified as avian, swine, or ruminant from USPS mail inspections (parcel post and express).  Examples would include equine or other unidentifiable animal byproduct.  Source document is PPQ form 287.",NULL,0,2011-12-05 15:24:53.0000000,0,2024-04-12 03:37:17.0000000,42,2,1,1
73,1137,USPS Mail Packages X-Rayed (including parcel post and express),Report the number of mail packages (parcel post and express) x-rayed.,NULL,0,2011-12-05 15:24:53.0000000,0,2024-04-12 03:37:17.0000000,42,2,1,1
74,1138,USPS Mail Violations PPQ 518 (including parcel post and express),Record the number of USPS mail violations (parcel post and express) issued. Source document is the PPQ518 and CBP AI 518.,NULL,0,2011-12-05 15:24:53.0000000,0,2024-04-12 03:37:17.0000000,42,2,1,1
77,1152,Clean/Disinfect Footwear,Clean/Disinfect Footwear: Record the number of pairs of footwear cleaned/disinfected to prevent animal diseases.,NULL,0,2011-12-05 15:24:53.0000000,0,2009-04-14 13:06:10.0000000,8,2,1,1
78,1153,Clean/Disinfect Aircraft,Clean/Disinfect Aircraft:  Record the number of aircraft that have been cleaned and disinfected to prevent animal diseases.,NULL,0,2011-12-05 15:24:53.0000000,0,2008-03-05 21:23:54.0000000,8,2,1,1
79,1154,Clean/Disinfect Other,"Clean/Disinfect Other:  Record the number of conveyances, containers, equipment, or other fomites that were cleaned/disinfected to prevent animal diseases.",NULL,0,2011-12-05 15:24:53.0000000,0,2008-03-05 21:25:30.0000000,8,2,1,1
80,1155,Animal Product Import Certificates Reviewed,"Animal Product Import Certificates Reviewed:  Record the number of Animal Product Import Certificates reviewed.  These certificates are required to support the entry requirements of the particular imported product into or through the U.S.  Examples: 1) Foreign meat certificate, 2) Veterinary certificate, 3) Animal casing certificate; and 4) Health certificate.",NULL,0,2011-12-05 15:24:53.0000000,0,2008-03-05 21:26:36.0000000,8,2,1,1
81,1160,Post Entry  Field Inspections,Report the number of follow-up site inspections of post entry materials. This does not include initial inspections of post entry materials at inspections stations. That is recorded under 1112.,NULL,0,2011-12-05 15:24:53.0000000,0,2003-11-10 11:50:54.0000000,9,1,1,1
84,1163,Emergency Action Orders (Form 523),"Report the number of emergency action orders, PPQ form 523, issued. (SITC users - use code under SITC pathway)",NULL,0,2011-12-05 15:24:53.0000000,0,2004-02-18 09:08:27.0000000,9,1,1,1
85,1165,CITES Violations/Non-Compliance Incidents,"Report the number of incidents that involve propagative CITES material that resulted in forfeiture or other corrective action to comply with CITES requirements. This may include obtaining a CITES permit, re-exportation, seizure, or transport to a Rescue Center.",NULL,0,2011-12-05 15:24:53.0000000,0,2004-04-29 07:26:58.0000000,9,1,1,1
88,1172,Inland QMIs Plant,Record the number of plant QMIs intercepted from all inland inspections.  Note: Three different fruits would count as three interceptions. Three oranges seized out of one container would count as one interception.,NULL,0,2011-12-05 15:24:53.0000000,0,2008-03-10 10:10:28.0000000,11,2,1,1
89,1173,Inland QMIs Meat/Poultry /Dairy,"Record the number of meat/poultry/dairy interceptions found incidental in inland cargo inspection.  These are products  classified as dairy, avian, swine, or ruminant. Do not include plant-based milk",NULL,0,2011-12-05 15:24:53.0000000,0,2008-03-11 08:02:27.0000000,11,2,1,1
91,1175,Inland Total Meat/Poultry/Dairy Byproducts QMIs,"Record the number of meat/poultry/dairy animal byproduct interceptions from inland cargo inspection. This number is for animal byproduct interceptions incidental to the cargo inspection, not the cargo itself.",NULL,0,2011-12-05 15:24:53.0000000,0,2008-03-10 10:24:00.0000000,11,2,1,1
94,1178,Inland Violations (Form 518),"Record the number of inland violations issued for containerized cargo. Include violations issued for unauthorized movement of regulated cargo. The source document is the PQ518
",NULL,0,2011-12-05 15:24:53.0000000,0,2008-03-10 10:26:40.0000000,11,2,1,1
95,1179,"Treatments, Inland Inspection  Cargo, Fumigation",Report the number of fumigations performed per shipment as defined by bill of lading.  Source is PPQ Form 429.,NULL,0,2011-12-05 15:24:53.0000000,0,2010-05-28 09:40:46.0000000,45,1,1,1
96,1180,"Inland Cargo/Conveyance Treatments, Non-Fumigation","Record the number of non-fumigation treatments performed in/on/with inland cargo or conveyance. Include cleaning/disinfection of conveyances, removing rice straw, washing (steam- cleaning) dirty vehicles, aerosol applications, destroying or re-exporting prohibited commodities such as orange peel, and reconditioning of cargo or violative WPM. (For animal-related treatments, see activity code 1154.)
",NULL,0,2011-12-05 15:24:53.0000000,0,2008-03-10 10:27:08.0000000,11,2,1,1
97,6341,"Commerce QMIs, Plant","Record the number of plant material interceptions (QMIs) from market, distributor, and related follow-up inspections (retail or wholesale). This includes all plant material requiring action (seizure, treatment, re-export).",NULL,0,2011-12-05 15:24:53.0000000,0,2006-09-22 08:21:32.0000000,12,1,1,1
98,6342,"Commerce QMIs, Plant, Weight","Record the estimated weight of the plant material interceptions from market, distributor, and related follow-up inspections in kilograms.",NULL,0,2011-12-05 15:24:53.0000000,0,2011-02-07 08:58:33.0000000,12,1,1,1
103,6347,Commerce Quarantine Pests,"Record the number of quarantine pests intercepted from market, distributor, and related follow-up inspections (retail or wholesale). This information is supplied by the identifiers.",NULL,0,2011-12-05 15:24:53.0000000,0,2025-02-22 04:36:40.0000000,12,1,1,1
104,6349,"Commerce Violations, PPQ 518","Record the number of Record of Violations (PPQ 518) issued on Regular Time from market, distributor, and related follow-up inspections.",NULL,0,2011-12-05 15:24:53.0000000,0,2006-09-22 08:24:47.0000000,12,1,1,1
107,2003,"Maritime Inspections, Ships Direct Foreign outside of Regular Hours","Record the number of direct foreign commercial vessels boarded and inspected outside regular hours of service. Include cruise ships, tankers, bulk carriers, and ocean-going tugs. Exclude yachts, military vessels, and historical craft (Count is by number of Form 288s completed)
",NULL,0,2011-12-05 15:24:53.0000000,0,2024-04-19 18:58:16.0000000,1,2,0,1
112,2020,"Treatments,  Maritime Cargo,  O/T Fumigation","Report the number of fumigations performed on cargo shipments outside the regular hours of service. The source form is APHIS 8030 or 429. Each stack, hence each APHIS 8030/429, counts as one fumigation. If one stack contains 5 B/Ls, it is still only one fumigation.",NULL,0,2011-12-05 15:24:53.0000000,0,2009-02-25 07:36:11.0000000,45,1,1,1
117,2048,"Treatments, Air Cargo, O/T Fumigation","Report the number of fumigations performed on cargo shipments outside the regular hours of service. The source form is APHIS 8030. Each stack, hence each APHIS 8030, counts as one fumigation. Note: iPhone stack contains five airway bills, it is still only one fumigation. A chamber fumigation may contain more than one airway bill, but it is only one fumigation.",NULL,0,2011-12-05 15:24:53.0000000,0,2009-02-25 07:36:33.0000000,45,1,1,1
124,2084,"Treatments, Land Broder Cargo, O/T Fumigation ",Report the number of fumigations conducted on cargo outside the regular hours of service. The APHIS 8030 that is filled out for each stack or the chart associated with a chamber fumigation would be the source document for each fumigation.,NULL,0,2011-12-05 15:24:53.0000000,0,2009-02-25 07:37:04.0000000,45,1,1,1
126,2092,"O/T Inspections, Reg Cargo, Airport ",Report the number by airway bills of reimbursable inspections/clearances of cargo.,NULL,0,2011-12-05 15:24:53.0000000,0,2007-04-02 13:02:46.0000000,39,1,1,1
127,2093,"O/T Inspections, Miscellaneous Cargo, Airport","Report by airway bill the number of Reimbursable inspections performed on miscellaneous air cargo. These inspections pertain only to Pre-departure activities. Note: If a regulated item is found during a miscellaneous inspection, that cargo is considered regulated.",NULL,0,2011-12-05 15:24:53.0000000,0,2007-04-02 12:49:51.0000000,39,1,1,1
128,2102,"O/T Cargo Treatments ","Report the number of cargo treatments performed outside the regular hours of service. Include cleaning and disinfection of vehicles; removing regulated items; fumigation for export commodities both foreign and to the mainland, etc.",NULL,0,2011-12-05 15:24:53.0000000,0,2003-11-06 15:14:39.0000000,39,1,0,1
129,2110,O/T Shipments Of Endangered Species,"Report the number of endangered species shipments which arrived from airport, maritime, or land border services and were inspected on a REIMBURSABLE basis. A shipment is one bill of lading, airway bill, truck entry, or the amount carried in baggage with each Customs declaration. Each variety does not count as a separate shipment. This code is paired with activity code 2111. Examples include two airway bills of cacti arriving from Mexico; three bills of lading containing orchids plants from Thailand; an entry of cycads arriving by truck at Brownsville.",NULL,0,2011-12-05 15:24:53.0000000,0,2003-04-15 09:01:23.0000000,5,1,1,1
130,2111,"O/T Plant Units In Shipments Of Endangered Species ","Report the number of plant units (cuttings, whole plants, propagative units other than seed) that were in the endangered species shipments reported under activity code 2110.",NULL,0,2011-12-05 15:24:53.0000000,0,2003-04-15 09:01:39.0000000,5,1,1,1
