ID,CODE,SHORT_DESCRIPTION,LONG_DESCRIPTION,COMMENTS,CREATED_BY_USER_ID,CREATED_DATETIME,MODIFIED_BY_USER_ID,MODIFIED_DATETIME,REF_WADS_PROGRAM_ID,REF_WADS_DEPARTMENT_ID,IS_ACTIVE,IS_MANUAL_ENTRY_ALLOWED
1113,3003D,Pharmaceutical Release Permit Harvest,"Record the number of BRS  Field Inspection for genetically engineered plants for a Pharmaceutical and/or Industrial Permit at time of harvest. Record the number of harvest Pharma Inspections completed(with final report submitted) - one per BRS inspection number (e.g., IN 07-633).",NULL,0,2011-12-05 15:24:53.0000000,0,2009-07-21 09:51:33.0000000,13,1,1,1
1114,3003F,Pharmaceutical Release Permit First Volunteer,"Record the number of BRS  Field Inspection for genetically engineered plants for a Pharmaceutical and/or Industrial Permit the following year to look for volunteering plants. Record the number of volunteer Pharma Inspections completed (with final report submitted) - one per BRS inspection number (e.g., IN 07-633).",NULL,0,2011-12-05 15:24:53.0000000,0,2009-07-21 09:51:52.0000000,13,1,1,1
1115,3006,Return to General Use,"Record the number of BRS Inspection for labs, machinery or equipment returning to general use. Record the number of Return to General Use Inspections completed (with final report submitted) - one per BRS inspection number (e.g., IN 07-633).",NULL,0,2011-12-05 15:24:53.0000000,0,2009-07-21 09:52:58.0000000,13,1,1,1
1116,3001,Notification Inspection,"Record the number of BRS Field Inspection for genetically engineered plants for Notifications. Record the number of Notification Inspections completed (with final Report submitted) - one per unique BRS inspection number (e.g., IN 07-633).",NULL,0,2011-12-05 15:24:53.0000000,0,2009-07-21 09:50:36.0000000,13,1,1,1
1117,3004A,Containment Facility Inspection,"Record the number of BRS  Facility Inspection for genetically engineered plants or other organisms.  Record the number of Containment Facility Inspections completed (with final report submitted) - one per BRS inspection number (e.g., IN 07-633).",NULL,0,2011-12-05 15:24:53.0000000,0,2009-07-21 09:52:11.0000000,13,1,1,1
1118,3007,Directed Inspection,"Record the number of BRS Inspection that is directed for any given circumstance determined by BRS to be necessary. This inspection is for unique conditions that are inspected for. Record the number of Directed Inspections completed (with final report submitted) - one per BRS inspection number (e.g., IN 07-633).",NULL,0,2011-12-05 15:24:53.0000000,0,2009-07-21 09:53:07.0000000,13,1,1,1
1122,3004C,Arthropod Containment Inspections,"Record the number of BRS Inspection for genetically engineered arthropods. Record the number of Arthropod Containment Inspections completed (with final report submitted) - one per BRS inspection number (e.g., IN 07-633).",NULL,0,2011-12-05 15:24:53.0000000,0,2009-07-21 09:52:31.0000000,13,1,1,1
1123,6341A,"QMIs, Plant (CkPt-BP)","Record the number of plant material interceptions (QMIs) from check points or Border Patrol stations. This includes all plant material requiring action (seizure, treatment, re-export).",NULL,0,2011-12-05 15:24:53.0000000,0,2006-09-22 09:08:37.0000000,12,1,1,1
1124,6342A,"QMIs, Plant, Weight (CkPt-BP)",Record the estimated weight of the plant material interceptions from check points or Border Patrol stations in kilograms.,NULL,0,2011-12-05 15:24:53.0000000,0,2011-02-07 08:58:41.0000000,12,1,1,1
1129,6347A,Quarantine Pests (CkPt-BP),Record the number of quarantine pests intercepted from check points or Border Patrol stations. This information is supplied by the identifiers.,NULL,0,2011-12-05 15:24:53.0000000,0,2025-02-22 04:36:39.0000000,12,1,1,1
1130,6349A,"Violations, PPQ 518 (CkPt-BP)",Record the number of Record of Violations (PPQ 518) issued from check points or Border Patrol stations on Regular Time.,NULL,0,2011-12-05 15:24:53.0000000,0,2006-09-22 08:40:08.0000000,12,1,1,1
1131,6350A,"Emergency Action Notices, Ppq 523 (CkPt-BP)",Record the number of Emergency Action Notifications (PPQ 523) issued from check points or Border Patrol stations.,NULL,0,2011-12-05 15:24:53.0000000,0,2006-09-22 08:41:03.0000000,12,1,1,1
1132,6351A,"Inspections, Check Point/Border Patrol",Record the number of transit conveyance inspections at weigh stations and Border Patrol checkpoint locations during regular hours of service.  Do not include port of entry locations.,NULL,0,2011-12-05 15:24:53.0000000,0,2006-09-22 08:54:55.0000000,12,1,1,1
1133,7351A,"O/T Inspections, Check Point/Border Patrol",Record the number of transit conveyance inspections at weigh stations and Border Patrol checkpoint locations during overtime hours of service.  Do not include port of entry locations.,NULL,0,2011-12-05 15:24:53.0000000,0,2006-09-22 09:06:34.0000000,12,1,1,1
1134,6352,Internal Referrals Completed,"Record the number of referrals received from PPQ, DHS, or other government agency that are completed during the reporting period.  Completion means that the referral information was followed up on and feedback information was provided back to the originator of the referral.",NULL,0,2011-12-05 15:24:53.0000000,0,2006-11-08 15:05:56.0000000,12,1,1,1
1135,6353,External Referrals Received,"Record the number of referrals tips received from non government agencies as a result from outreach to private industry, organizations, associations, and/or public awareness.  The tip is shared information which initiates follow-up action, trace back, trace forwards for SITC purposes.",NULL,0,2011-12-05 15:24:53.0000000,0,2006-09-22 08:28:16.0000000,12,1,1,1
1136,6354,Outreach - Formal Presentations and Meetings,"Record the number of formal presentations given and meetings or trade shows attended for the purpose of informing other agencies, private industry, non-government organizations and associations, and/or the public about the SITC mission and regulations.  Each presentation or meeting is a single outreach activity regardless of how many individuals attend the presentation, meeting or trade show.",NULL,0,2011-12-05 15:24:53.0000000,0,2006-09-22 08:28:49.0000000,12,1,1,1
1137,6355,Queries Conducted,"Record the number of queries made utilizing PPQ databases, CBP databases, or other databases for purpose of analyzing shipments entering or moving, and the companies or individuals involved.",NULL,0,2011-12-05 15:24:53.0000000,0,2006-09-22 08:29:31.0000000,12,1,1,1
1138,6356,Alerts Generated,"Record the number of alerts (local or national) that originated from the work unit.  Alerts are documents stating that a product or products of concern may be entering through a port/s.  An alert is based on known prohibited products that have been found and traced back to the Port of Entry.  The unit making the determination as to how and where the product entered, and thereby generating the alert, is the one that will Record the alert.",NULL,0,2011-12-05 15:24:53.0000000,0,2006-09-22 08:30:16.0000000,12,1,1,1
1139,6347B,Commerce Interceptions Non-Quarantine Pest,"Record the number of non-quarantine pests intercepted from SITC blitzes, market inspections, distributor, and follow-up inspections (retail or wholesale). Include both overtime and regular time. Information supplied by USDA PPQ identifiers. A non-quarantine pest is a pest (insect, seed, disease, mollusk, and plant material) submitted on a PPQ form 309A or 391 in which after final identification is complete, no action is required.",NULL,0,2011-12-05 15:24:53.0000000,0,2025-02-22 04:36:39.0000000,12,1,1,1
1141,1165A,CITES Violations/Non-Compliance Incidents,"Report the number of incidents that involve non-propagative plant CITES material that resulted in forfeiture or other corrective action to comply with CITES requirements. This may include obtaining a CITES permit, re-exportation, or seizure from passenger baggage, mail, or cargo.  Example would include mahogany lumber or other refined products made out of CITES materials.",NULL,0,2011-12-05 15:24:53.0000000,0,2010-06-16 09:28:42.0000000,9,2,1,1
1142,1118A,"Seed Treatments, Non-Fumigant","Report the number of Seed shipments requiring treatment other than fumigation during regular hours of service.  Include dips, manual removal, deep burial, incineration, grinding, etc. This activity is paired with 1118B.",NULL,0,2011-12-05 15:24:53.0000000,0,2010-04-22 10:35:47.0000000,5,1,1,1
1143,1118B,"Seed Treatments, Non-Fumigant (KGS)","Report the number of Seed shipments requiring treatment other than fumigation during regular hours of service in kilograms.  Include dips, manual removal, deep burial, incineration, grinding, etc.",NULL,0,2011-12-05 15:24:53.0000000,0,2010-04-22 10:35:19.0000000,5,1,1,1
1144,1118C,"Plant Treatments, Non-Fumigant","Report the number of propagative plant shipments requiring treatment other than fumigation during regular hours of service.  Include dips, manual removal, deep burial, incineration, grinding, etc..  This activity is paired with 1118D.",NULL,0,2011-12-05 15:24:53.0000000,0,2004-04-29 07:50:59.0000000,5,1,1,1
1145,1118D,"Plant Treatments, Non-Fumigant  (Plant Units)","Report the number of propagative plant units requiring treatment other than fumigation during regular hours of service.  Include dips, manual removal, deep burial, incineration, grinding, etc.",NULL,0,2011-12-05 15:24:53.0000000,0,2007-05-15 13:23:39.0000000,5,1,1,1
1146,2118A,"O/T Seed Treatments, Non-Fumigant","Report the number of Seed shipments requiring treatment other than fumigation during overtime hours.  Include dips, manual removal, deep burial, incineration, grinding, etc..  This activity is paired with 2118B.",NULL,0,2011-12-05 15:24:53.0000000,0,2004-04-29 07:52:55.0000000,5,1,1,1
1147,2118B,"O/T Seed Treatments, Non-Fumigant (KGS)","Report the number of Seed shipments requiring treatment other than fumigation during overtime hours in kilograms.  Include dips, manual removal, deep burial, incineration, grinding, etc..",NULL,0,2011-12-05 15:24:53.0000000,0,2004-04-29 07:58:02.0000000,5,1,1,1
1148,2118C,"O/T Plant Treatments, Non-Fumigant","Report the number of propagative plant shipments requiring treatment other than fumigation during overtime hours.  Include dips, manual removal, deep burial, incineration, grinding, etc.. This activity is paired with 2118D.",NULL,0,2011-12-05 15:24:53.0000000,0,2004-04-29 07:54:53.0000000,5,1,1,1
1149,2118D,"O/T Plant Treatments, Non-Fumigant (Plant Units)","Report the number of propagative plant units requiring treatment other than fumigation during overtime hours.  Include dips, manual removal, deep burial, incineration, grinding, etc.",NULL,0,2011-12-05 15:24:53.0000000,0,2007-05-15 13:23:58.0000000,5,1,1,1
1150,1114A,Interceptions Quarantine (All Areas),"Report the number of quarantine pest being identified by identifiers for their area of coverage during regular hours of service. This would include interceptions for air, land, sea, rail, PIS, domestic, SITC, etc.. This would include quarantine pest with no action and quarantine pest that require action. This is to measure identifier workload.",NULL,0,2011-12-05 15:24:53.0000000,0,2025-02-22 04:36:39.0000000,5,1,1,1
1151,1115A,Interceptions Non-Quarantine (All Areas),"Report the number of non-quarantine pest being identified by identifiers for their area of coverage during regular hours of service. This would include interceptions for air, land, sea, rail, PIS, domestic, SITC, etc.. This is to measure identifier workload.",NULL,0,2011-12-05 15:24:53.0000000,0,2025-02-22 04:36:39.0000000,5,1,1,1
1152,2114A,O/T Interceptions Quarantine (All Areas),"Report the number of quarantine pest being identified by identifiers for their area of coverage during overtime hours. This would include interceptions for air, land, sea, rail, PIS, domestic, SITC, etc.. This is to measure identifier workload.",NULL,0,2011-12-05 15:24:53.0000000,0,2025-02-22 04:36:39.0000000,5,1,1,1
1153,2115A,O/T Interceptions Non-Quarantine (All Areas),"Report the number of non-quarantine pest being identified by identifiers for their area of coverage during overtime hours. This would include interceptions for air, land, sea, rail, PIS, domestic, SITC, etc.. This is to measure identifier workload.",NULL,0,2011-12-05 15:24:53.0000000,0,2025-02-22 04:36:40.0000000,5,1,1,1
1164,1091B,"Inspection, Domestic Vessels Pax/Crew",Report the number of passenger and crew processed through Maritime vessels whether actual physical inspection of their baggage was or was not conducted.,NULL,0,2011-12-05 15:24:54.0000000,0,2004-12-21 09:58:07.0000000,39,1,1,1
1165,1090B,"Inspections, Domestic Vessels",Report the number of Maritime Vessels inspected in pre departure services.,NULL,0,2011-12-05 15:24:54.0000000,0,2004-12-21 09:59:18.0000000,39,1,1,1
1176,1126B,Live Canadian CITES/ESA,"Report the number of live plants shipments which are of Canadian origin AND listed (a) in one of the Appendices to the Convention on International Trade in Endangered Species of Wild Fauna and Flora (CITES), and/or (b) as Threatened or Endangered under the Endangered Species Act (ESA).  This code to be used by CITES designated ports, only (see 50 CFR part 24).  CITES plants are regulated under 50CFR part 23.  ESA plants are regulated under 50 CFR part 17.  These shipments are inspected and released by CBP AI Officials and are not sent to an inspection station. A shipment is one truck on the manifest Each variety does not count as a separate shipment. This code is paired with activity code 1126C.",NULL,0,2011-12-05 15:24:54.0000000,0,2005-08-23 09:17:42.0000000,9,2,1,1
1177,1126C,Live Canadian CITES Plant Units,"Report the number of plant units (cuttings, whole plants, propagative units (other than seed)) that were in the endangered species shipments arriving from Canada via a northern land border crossing that was inspected and released by CBP AI Officials.  The number of shipments is reported under activity code 1126B.",NULL,0,2011-12-05 15:24:54.0000000,0,2005-06-30 07:28:53.0000000,9,2,1,1
1187,1110A,Shipments of Endangered Seeds,"Report the number of endangered species (ESA) or CITES seed shipments which arrived from airport, maritime, or land border services and were inspected. A shipment is one bill of lading, airway bill, or the amount carried in baggage with each custom declaration. Each variety does not count as a separate shipment. This code is paired with activity code 1111A.",NULL,0,2011-12-05 15:24:53.0000000,0,2005-09-29 12:54:24.0000000,5,1,1,1
1188,1111A,KGS of Endangered Seeds,Report the Kilograms of CITES and ESA seed shipments reported under activity code 1110A.,NULL,0,2011-12-05 15:24:53.0000000,0,2005-09-29 12:54:50.0000000,5,1,1,1
1189,2110A,O/T Shipments of Endangered Seeds,"Report the number of endangered species (ESA) or CITES seed shipments which arrived from airport, maritime, or land border services and were inspected on a REIMBURSABLE basis. A shipment is one bill of lading, airway bill, or the amount carried in baggage with each custom declaration. Each variety does not count as a separate shipment. This code is paired with activity code 2111A.",NULL,0,2011-12-05 15:24:53.0000000,0,2005-09-29 12:55:23.0000000,5,1,1,1
1190,2111A,O/T KGS of Endangered Seeds,Report the Kilograms of CITES and ESA seed shipments reported under activity code 2110A that were inspected on a REIMBURSABLE basis.,NULL,0,2011-12-05 15:24:54.0000000,0,2005-09-29 12:55:53.0000000,5,1,1,1
1191,1069A,Land Border VS 17-8 Issued (Pet Birds,"Record the number of VS 17-8 (Agreement of Pet Bird Owner) issued from a vehicle, pedestrian, bus, border patrol, or other land border activity.",NULL,0,2011-12-05 15:24:53.0000000,0,2008-03-13 06:36:53.0000000,3,2,1,1
1192,1069B,Land Border Live Birds Seized,"Record the total number of birds seized from a vehicle, pedestrian, bus, border patrol, or other land border activity.  Source document VS 17-8.",NULL,0,2011-12-05 15:24:53.0000000,0,2008-03-13 06:37:27.0000000,3,2,1,1
1193,1045A,"Airport Baggage VS 17-8 Issued (Pet Birds) ","Record the number of VS 17-8 (Agreement of Pet Bird Owner) issued from an arriving air passenger, crew member, or Air  and  Marine.  This code is paired with 1045B, if birds are seized.
",NULL,0,2011-12-05 15:24:54.0000000,0,2008-02-22 13:01:29.0000000,2,2,1,1
1194,1045B,Airport Baggage Live Birds Seized,"Record the total number of birds seized from an arriving air passenger or crew member.  Source document VS 17-8.  This code is paired with 1045A, if birds are seized.
",NULL,0,2011-12-05 15:24:54.0000000,0,2008-02-22 13:02:27.0000000,2,2,1,1
1195,1017A,"Maritime Baggage VS 17-8 Issued (Pet Birds) ","Record the number of VS 17-8 (Agreement of Pet Bird Owner) issued from a maritime passenger, crew member, or Air  and  Marine.  This code is paired with 1017B if birds are seized.
",NULL,0,2011-12-05 15:24:54.0000000,0,2008-03-10 14:21:43.0000000,1,2,1,1
1196,1017B,Maritime Baggage Live Birds Seized,"Record the total number of birds seized from an arriving maritime passenger or crew member.  Source document VS 17-8.  This code is paired with 1017A if birds are seized.
",NULL,0,2011-12-05 15:24:54.0000000,0,2008-03-10 14:22:18.0000000,1,2,1,1
1203,6361A,Annual Commerce Site Inspection - Commerce Site Compliant,Record the number of annual commerce site inspections during regular hours found in compliance (no prohibited items seized or identified at the site).  An annual commerce site inspection is the first inspection in a 365-day cycle. Record as follow-up inspections all subsequent visits of the site within 365 days of a previous inspection.,NULL,0,2011-12-05 15:24:54.0000000,0,2006-09-22 09:01:57.0000000,12,1,1,1
1204,7361A,O/T Annual Commerce Site Inspection - Commerce Site Compliant,Record the number of annual commerce site inspections outside of regular hours found in compliance (no prohibited items seized or identified at the site).  An annual commerce site inspection is the first inspection in a 365-day cycle. Record as follow-up inspections all subsequent visits of the site within 365 days of a previous inspection.,NULL,0,2011-12-05 15:24:54.0000000,0,2006-09-22 08:15:43.0000000,12,1,1,1
1205,6361B,Follow-up Visit ? All items found in Compliance in most recent visit.,Record the number of follow-up inspections conducted at a commerce site that was found compliant in the most recent visit within the 12 month time period established for each site on Regular Time.,NULL,0,2011-12-05 15:24:54.0000000,0,2006-09-22 09:02:36.0000000,12,1,1,1
1206,7361B,O/T Follow-up Visit - All items found in Compliance-most recent visit,Record the number of follow-up inspections conducted at a commerce site that was found compliant in the most recent visit within the 12 month time period established for each site on Overtime.,NULL,0,2011-12-05 15:24:54.0000000,0,2006-09-22 08:17:04.0000000,12,1,1,1
1207,6361C,Follow-up Visit ? Non-Compliant  items previously found,Record the number of follow-up inspections conducted at a commerce site found non-compliant in the most recent visit within the 12 month time period established for each site on Regular Time.,NULL,0,2011-12-05 15:24:54.0000000,0,2006-09-22 09:03:00.0000000,12,1,1,1
1208,7361C,O/T Follow-up Visit - Non-Compliant  items previously found,Record the number of follow-up inspections conducted at a commerce site found non-compliant in the most recent visit within the 12 month time period established for each site on Overtime.,NULL,0,2011-12-05 15:24:54.0000000,0,2006-09-22 08:17:51.0000000,12,1,1,1
1209,6361D,Commerce Site Visit resulting from Referral/Tip/Recall,Record the number of commerce site inspections resulting from a referral/tip (internal or external) including recall inspections during Regular Time.,NULL,0,2011-12-05 15:24:54.0000000,0,2007-03-06 11:23:11.0000000,12,1,1,1
1210,7361D,O/T Commerce Site Visit resulting from Referral/Tip/Recall,Record the number of commerce site inspections resulting from a referral/tip (internal or external) including recall inspections during Overtime.,NULL,0,2011-12-05 15:24:54.0000000,0,2006-09-29 09:08:01.0000000,12,1,1,1
1211,6361E,"Positive Visit (i.e., non-compliant items were found)",Record the number of visits to commerce sites where one or more non-compliant items were found.  A single positive visit will be Recorded regardless of the number of items found.,NULL,0,2011-12-05 15:24:54.0000000,0,2006-09-22 09:03:56.0000000,12,1,1,1
1213,6350B,First Time EAN Issue for a commodity (Commerce Site / Domestic Source),"Record the number of first time Emergency Action Notifications issued for actions taken on a commodity (seized, re-exported, treated) at a commerce site or domestic source (residential) from a Regular Time.  This would also include recalls.  Do not include Holds. Record holds under 6350D.",NULL,0,2011-12-05 15:24:54.0000000,0,2006-09-22 08:43:10.0000000,12,1,1,1
1214,6350C,Repeat EAN Issued for a commodity (Commerce Site / Domestic Source),"Record the number of repeat Emergency Action Notifications issued to a commerce site or domestic source (residential) for actions taken (seized, re-exported, treated) on the same commodity from an Regular Time visit.  This would also include recalls. Do not include Holds. Record holds under 6350D.",NULL,0,2011-12-05 15:24:54.0000000,0,2006-09-22 08:45:31.0000000,12,1,1,1
1215,6350D,Commerce EAN Holds,Record the number of EANs issued to place a hold on a product when the product at a commerce site and was released on Regular Time with no further action taken.  Only record after the final determination has been made.,NULL,0,2011-12-05 15:24:54.0000000,0,2006-09-22 08:45:17.0000000,12,1,1,1
1216,6357A,Tracebacks Initiated,Record the number of tracebacks initiated by your work unit.  Do not count traceback actions forwarded to your location from another work unit,NULL,0,2011-12-05 15:24:54.0000000,0,2006-09-22 08:55:40.0000000,12,1,1,1
1217,6357B,Tracebacks Completed (Non-Compliant),The work unit closing the traceback shall record the number of non-compliant pathways completed at the domestic importer level or domestic source.,NULL,0,2011-12-05 15:24:54.0000000,0,2006-11-08 15:14:49.0000000,12,1,1,1
1218,6357C,Tracebacks Completed (Compliant),The work unit closing the traceback shall record the number of tracebacks found compliant.,NULL,0,2011-12-05 15:24:54.0000000,0,2006-09-22 08:55:55.0000000,12,1,1,1
1219,6357D,Tracebacks Completed (Dead End),The work unit closing the traceback shall record the number of dead end tracebacks.,NULL,0,2011-12-05 15:24:54.0000000,0,2006-09-22 08:56:04.0000000,12,1,1,1
1220,6359A,POE Joint (PPQ/CBP) Special Operation Work Proposals Written,Record the number of written joint special operation work plans proposed with CBP at ports of entry.,NULL,0,2011-12-05 15:24:54.0000000,0,2006-09-22 09:00:16.0000000,12,1,1,1
1221,6359B,POE Joint (PPQ/CBP) Special Operation Work Proposals Approved,Record the number of joint special operations at ports of entry approved by CBP.,NULL,0,2011-12-05 15:24:54.0000000,0,2006-09-22 09:00:20.0000000,12,1,1,1
1222,6359C,POE Joint (PPQ/CBP) Special Operation Work Proposals Completed,"Record the number of joint special operations with CBP at ports of entry completed in the air, land, sea, rail, inland, mail and express carrier pathways.",NULL,0,2011-12-05 15:24:54.0000000,0,2006-09-22 09:00:26.0000000,12,1,1,1
1223,1139A,USPS Express Mail Interception Notices Issued (Form 287),"Record the number of Mail Interception Notices (Form 287) issued from USPS Express Mail.
",NULL,0,2011-12-05 15:24:54.0000000,0,2024-04-19 18:58:16.0000000,40,2,0,1
1226,1130B,Express Courier Packages Inspected,"Record the number of packages which have been physically opened and inspected by Agriculture at a courier facility or via a courier conveyance (FedEx, DHL, UPS, etc.) for express courier packages.  Packages that have been x-rayed only are recorded under code 1137B.  An Express Courier is defined in 19 CFR 128.",NULL,0,2011-12-05 15:24:54.0000000,0,2008-03-05 21:31:49.0000000,46,2,1,1
1227,1131B,Express Courier regulated/prohibited Plant/Plant Products,"Express Courier Plant/Plant Product Interceptions: Record the number of regulated/prohibited plants/plant products intercepted from express courier packages (FedEx, DHL, UPS, etc.). NOTE: Three different fruits would count as three interceptions. Three oranges seized out of one container would count as one interception.""",NULL,0,2011-12-05 15:24:54.0000000,0,2008-03-05 21:33:24.0000000,46,2,1,1
1229,1137B,Number Of Express Courier Packages X-Rayed,"Record the number of Express Courier (FedEx, DHL, UPS, etc.) packages x-rayed.",NULL,0,2011-12-05 15:24:54.0000000,0,2010-08-30 09:56:56.0000000,46,2,1,1
1231,1132BP,Express Courier regulated/prohibited  Avian Meat/Meat Products,"Express Courier Avian Meat/Meat Product is an agricultural product specifically regulated by 9 CFR; it includes only the edible animal materials (i.e., for human consumption).  Ingredients lists should be checked for meat products; determine and record the dominant meat type.  Record the number of avian meat / meat product / meat byproduct interceptions from express courier packages (FedEx, DHL, UPS, etc.).",NULL,0,2011-12-05 15:24:54.0000000,0,2008-03-05 21:39:41.0000000,46,2,1,1
1232,1132BD,Express Courier regulated/prohibited Milk/Milk Products,"Express Courier Milk/Milk Product is an agricultural product specifically regulated by 9 CFR; it includes edible and inedible animal materials.  Record the number of milk / milk product interceptions from express courier packages (FedEx, DHL, UPS, etc).",NULL,0,2011-12-05 15:24:54.0000000,0,2008-03-05 21:41:00.0000000,46,2,1,1
