ID,CODE,SHORT_DESCRIPTION,LONG_DESCRIPTION,COMMENTS,CREATED_BY_USER_ID,CREATED_DATETIME,MODIFIED_BY_USER_ID,MODIFIED_DATETIME,REF_WADS_PROGRAM_ID,REF_WADS_DEPARTMENT_ID,IS_ACTIVE,IS_MANUAL_ENTRY_ALLOWED
1617,1054B,Airport Total Pest Interceptions Submitted - Cargo,"Record the total number of pests intercepted and submitted for identification from air cargo.
",NULL,0,2011-12-05 15:24:54.0000000,0,2008-02-22 13:12:55.0000000,2,2,1,1
1618,1054C,"Airport Aircraft Total Pest Interceptions Submitted Stores, Quarters, ","Record the total number of pests intercepted and submitted for identification from aircraft galley, quarters, stores, and holds.
",NULL,0,2011-12-05 15:24:54.0000000,0,2008-02-22 13:13:44.0000000,2,2,1,1
1619,1087A,Land Border Total Pest Interceptions Submitted - Pedestrian,Record the number of pests intercepted and submitted for identification from pedestrian 'mandado' and or baggage.,NULL,0,2011-12-05 15:24:54.0000000,0,2024-04-19 18:58:13.0000000,3,2,0,1
1620,1087B,Land Border Total Pest Interceptions Submitted - Vehicle,"Record the number of pests intercepted and submitted for identification from passenger vehicles.
",NULL,0,2011-12-05 15:24:54.0000000,0,2024-04-19 18:58:13.0000000,3,2,0,1
1621,1087C,Land Border Total Pest Interceptions Submitted - Truck Cargo,"Record the number of pests intercepted and submitted for identification from land border truck cargo.
",NULL,0,2011-12-05 15:24:54.0000000,0,2008-03-16 22:27:04.0000000,3,2,1,1
1622,1087D,Land Border Total Pest Interceptions Submitted - Buses,"Record the number of pest intercepted and submitted for identification from land border buses.
",NULL,0,2011-12-05 15:24:54.0000000,0,2024-04-19 18:58:14.0000000,3,2,0,1
1623,1087E,Land Border Total Pest Interceptions Submitted - Railcars,"Record the number of pests intercepted and submitted for identification from land border railcars.
",NULL,0,2011-12-05 15:24:54.0000000,0,2024-04-19 18:58:14.0000000,3,2,0,1
1624,1087F,Land Border Total Pest Interceptions Submitted - Passenger Trains,"Record the number of pests intercepted and submitted for identification from land border passenger trains.
",NULL,0,2011-12-05 15:24:54.0000000,0,2024-04-19 18:58:14.0000000,3,2,0,1
1625,1105A,"Pre-Clearance CBP Pest Interceptions Submitted,  Baggage",Report the number of pests intercepted and submitted for identification from Pre-Clearance passenger/crew baggage.,NULL,0,2011-12-05 15:24:54.0000000,0,2008-03-10 13:14:42.0000000,41,2,1,1
1626,1105B,"Pre-Clearance CBP Pest Interceptions Submitted, Cargo",Report the number of pests intercepted and submitted for identification from Pre-Clearance cargo.,NULL,0,2011-12-05 15:24:54.0000000,0,2024-04-19 18:58:14.0000000,41,2,0,1
1627,1105C,"Pre-Clearance CBP Pest Interceptions Submitted, Stores & Quarters",Report the number of pests intercepted and submitted for identification from Pre-Clearance commercial passenger airline stores & quarters.,NULL,0,2011-12-05 15:24:54.0000000,0,2008-03-10 13:16:21.0000000,41,2,1,1
1628,1141,USPS Mail Pest Interceptions Submitted by CBP (including parcel post and express),Record the number of pests intercepted and submitted for identification in international mail (parcel post and express).,NULL,0,2011-12-05 15:24:54.0000000,0,2025-02-22 04:36:39.0000000,42,2,1,1
1629,1140C,Express Courier Pest Interceptions Submitted,"Record the number of pests intercepted and submitted for identification from an Express Courier package (FedEx, DHL, UPS, etc.).",NULL,0,2011-12-05 15:24:54.0000000,0,2008-03-05 21:57:21.0000000,46,2,1,1
1630,1177B,Inland Pest Interceptions Submitted by CBP,"Record the number of pests intercepted and submitted for identification from inland containers  and  or their contents.
",NULL,0,2011-12-05 15:24:54.0000000,0,2008-03-10 10:26:08.0000000,11,2,1,1
1631,6150AR,Airport Reject-Commercial Ruminant,"Record by AWB, House Bills, Manifest, or B/L the number of commercial air cargo air cargo Ruminant shipments rejected by CBP as a result of SITC specific information.",NULL,0,2011-12-05 15:24:54.0000000,0,2006-09-22 10:52:07.0000000,12,1,1,1
1632,6150AS,Airport Reject-Commercial Swine,"Record by AWB, House Bills, Manifest, or B/L the number of commercial air cargo air cargo Swine shipments rejected by CBP as a result of SITC specific information.
",NULL,0,2011-12-05 15:24:54.0000000,0,2006-09-22 10:54:48.0000000,12,1,1,1
1633,6151AD,Airport Reject-Commercial Dairy (KGS),"Record the weight in kilograms of commercial air cargo Dairy products rejected by CBP as a result of SITC specific information.
",NULL,0,2011-12-05 15:24:54.0000000,0,2006-09-22 10:55:10.0000000,12,1,1,1
1634,6151AE,Airport Reject-Commercial Equine (KGS),"Record the weight in kilograms of commercial air cargo Equine products rejected by CBP as a result of SITC specific information.
",NULL,0,2011-12-05 15:24:54.0000000,0,2006-09-22 10:55:35.0000000,12,1,1,1
1635,6151AP,Airport Reject-Commercial Poultry (KGS),"Record the weight in kilograms of commercial air cargo Poultry products rejected by CBP as a result of SITC specific information.
",NULL,0,2011-12-05 15:24:54.0000000,0,2006-09-22 10:55:58.0000000,12,1,1,1
1636,6151AR,Airport Reject-Commercial Ruminant (KGS),"Record the weight in kilograms of commercial air cargo Ruminant products rejected by CBP as a result of SITC specific information.
",NULL,0,2011-12-05 15:24:54.0000000,0,2006-09-22 10:56:25.0000000,12,1,1,1
1637,6151AS,Airport Reject-Commercial Swine (KGS),"Record the weight in kilograms of commercial air cargo Swine products rejected by CBP as a result of SITC specific information.
",NULL,0,2011-12-05 15:24:54.0000000,0,2006-09-22 10:56:46.0000000,12,1,1,1
1638,6157AD,Airport Reject-Commercial Dairy Byproduct,"Record by AWB, House Bills, Manifest, or B/L the number of commercial air cargo inedible Dairy byproduct shipments rejected by CBP as a result of SITC specific information.
",NULL,0,2011-12-05 15:24:54.0000000,0,2006-09-22 10:57:07.0000000,12,1,1,1
1639,6157AE,Airport Reject-Commercial Equine Byproduct,"Record by AWB, House Bills, Manifest, or B/L the number of commercial air cargo inedible Equine byproduct shipments rejected by CBP as a result of SITC specific information .
",NULL,0,2011-12-05 15:24:54.0000000,0,2006-09-22 10:57:51.0000000,39,1,0,1
1640,6157AP,Airport Reject-Commercial Poultry Byproduct,"Record by AWB, House Bills, Manifest, or B/L the number of commercial air cargo inedible Poultry byproduct shipments rejected by CBP as a result of SITC specific information.
",NULL,0,2011-12-05 15:24:54.0000000,0,2006-09-22 10:58:11.0000000,12,1,1,1
1641,6157AR,Airport Reject-Commercial Ruminant Byproduct,"Record by AWB, House Bills, Manifest, or B/L the number of commercial air cargo inedible Ruminant byproduct shipments rejected by CBP as a result of SITC specific information.
",NULL,0,2011-12-05 15:24:54.0000000,0,2006-09-22 10:58:31.0000000,12,1,1,1
1642,6157AS,Airport Reject-Commercial Swine Byproduct,"Record by AWB, House Bills, Manifest, or B/L the number of commercial air cargo inedible Swine byproduct shipments rejected by CBP as a result of SITC specific information.
",NULL,0,2011-12-05 15:24:54.0000000,0,2006-09-22 10:58:55.0000000,12,1,1,1
1643,6158AD,Airport Reject-Commercial Dairy Byproduct (KGS),"Record the weight in kilograms of commercial air cargo inedible Dairy byproduct shipments rejected by CBP as a result of SITC specific information.
",NULL,0,2011-12-05 15:24:54.0000000,0,2006-09-22 10:59:18.0000000,12,1,1,1
1644,6092,Pre-Departure Air Cargo Verifications,Record by airway bill the number of verifications conducted during both regular and overtime hours of service on regulated and miscellaneous air cargo departing Puerto Rico or Hawaii heading to the United States. Include irradiated and hot water treated commodities.,NULL,0,2011-12-05 15:24:54.0000000,0,2006-09-22 10:59:30.0000000,12,1,1,1
1645,6158AE,Airport Reject-Commercial Equine Byproduct (KGS),"Record the weight in kilograms of commercial air cargo inedible Equine byproduct shipments rejected by CBP as a result of SITC specific information.
",NULL,0,2011-12-05 15:24:54.0000000,0,2006-09-22 10:59:42.0000000,12,1,1,1
1646,6098,Pre-Departure QMIs Plant Maritime Cargo,"Record the number of plant QMIs intercepted from Pre-departure air cargo verifications from Puerto Rico, U.S. Virgin Island, or Hawaii to the United States.",NULL,0,2011-12-05 15:24:54.0000000,0,2006-09-22 10:59:51.0000000,12,1,1,1
1647,6092A,Pre-Departure Maritime Cargo Verifications,"Record by bill of lading the number of verifications performed during regular hours of service on regulated and miscellaneous cargo departing Puerto Rico, U.S. Virgin Islands, or Hawaii on a maritime vessel heading to the United States.",NULL,0,2011-12-05 15:24:54.0000000,0,2006-09-22 11:00:10.0000000,12,1,1,1
1648,6158AP,Airport Reject-Commercial Poultry Byproduct (KGS),"Record the weight in kilograms of commercial air cargo inedible Poultry byproduct shipments rejected by CBP as a result of SITC specific information.
",NULL,0,2011-12-05 15:24:54.0000000,0,2006-09-22 11:00:19.0000000,12,1,1,1
1649,6092B,Pre-Departure Arriving Air Cargo Inspection,"Record by air waybill the number of verifications conducted during both regular and overtime hours of service on regulated and miscellaneous air cargo departing from the United States and arriving into Puerto Rico, U.S. Virgin Island, or Hawaii.",NULL,0,2011-12-05 15:24:55.0000000,0,2006-09-22 11:00:31.0000000,12,1,1,1
1650,6092C,Pre-Departure Arriving Maritime Cargo Inspection,"Record by bill of lading the number of verifications performed during both regular and overtime hours of service on regulated and miscellaneous cargo departing from the United States and arriving into Puerto Rico, U.S. Virgin Island, or Hawaii on a maritime vessel.",NULL,0,2011-12-05 15:24:55.0000000,0,2006-09-22 11:00:57.0000000,12,1,1,1
1651,6092D,Pre-Departure Arriving QMIs Plant Maritime Cargo,"Record the number of plant QMIs intercepted from Pre-departure air cargo verifications arriving from the United States into Puerto Rico, U.S. Virgin Island, or Hawaii.",NULL,0,2011-12-05 15:24:55.0000000,0,2006-09-22 11:01:21.0000000,12,1,1,1
1652,6092E,Pre-Departure Arriving QMIs Plant Air Cargo,"Record the number of plant QMIs intercepted from Pre-departure maritime cargo verifications arriving from the United States into Puerto Rico, U.S. Virgin Island, or Hawaii.",NULL,0,2011-12-05 15:24:55.0000000,0,2006-09-22 11:01:42.0000000,12,1,1,1
1653,6098B,Pre-Departure QMIs Plant Air Cargo,"Record the number of plant QMIs intercepted from Pre-departure maritime cargo verifications from Puerto Rico, U.S. Virgin Island, or Hawaii to the United States.",NULL,0,2011-12-05 15:24:55.0000000,0,2006-09-22 11:02:16.0000000,12,1,1,1
1654,7092,Pre-Departure O/T Air Cargo Verifications,"Record by air waybill the number of verifications performed during overtime hours of service on regulated and miscellaneous cargo departing Puerto Rico, U.S. Virgin Islands, or Hawaii in air cargo heading to the United States.",NULL,0,2011-12-05 15:24:55.0000000,0,2006-09-22 11:46:42.0000000,12,1,1,1
1655,7092A,Pre-Departure O/T Maritime Cargo Verifications,"Record by bill of lading the number of verifications performed during overtime hours of service on regulated and miscellaneous cargo departing Puerto Rico, U.S. Virgin Islands, or Hawaii on a maritime vessel heading to the United States.",NULL,0,2011-12-05 15:24:55.0000000,0,2006-09-22 11:03:04.0000000,12,1,1,1
1656,6158AR,Airport Reject-Commercial Ruminant Byproduct  (KGS),"Record the weight in kilograms of commercial air cargo inedible Ruminant byproduct shipments rejected by CBP as a result of SITC specific information.
",NULL,0,2011-12-05 15:24:55.0000000,0,2006-09-22 11:07:11.0000000,12,1,1,1
1657,6158AS,Airport Reject-Commercial Swine Byproduct  (KGS),"Record the weight in kilograms of commercial air cargo inedible Swine byproduct shipments rejected by CBP as a result of SITC specific information.
",NULL,0,2011-12-05 15:24:55.0000000,0,2006-09-22 11:07:31.0000000,12,1,1,1
1658,7035B,"O/T Airport Cargo, Verifications","Record the number of Overtime PHYSICAL VERIFICATIONS performed on cargo by air waybill within the regular hours of service.  These verifications are performed on contents of air cargo to insure the cargo matches the manifest and is compliant with APHIS regulations. Do not include examinations by X-RAY ONLY or paper reviews!
",NULL,0,2011-12-05 15:24:55.0000000,0,2006-09-22 11:07:50.0000000,12,1,1,1
1659,6130B,"Express Courier (Fed-x, UPS, etc.) Packages Verified",Record the number of Regular Time Express Carrier packages verified (physically opened) by SITC. Do not include packages which have been X-rayed or screened by K-9.,NULL,0,2011-12-05 15:24:55.0000000,0,2006-09-22 11:08:11.0000000,12,1,1,1
1660,6131B,"Express Courier QMIs (Fed-x, UPS, etc.) Plant Material",Record the number of plant QMI intercepted during express mail verifications.,NULL,0,2011-12-05 15:24:55.0000000,0,2008-05-30 08:32:35.0000000,12,1,1,1
1661,6131BK,"Express Courier QMIs (Fed-x, UPS, etc.) Plant Material, Weight",Record the weight in kilograms of plant material interceptions from express mail.,NULL,0,2011-12-05 15:24:55.0000000,0,2008-05-30 08:32:46.0000000,12,1,1,1
1662,6131C,"Express Courier (Fed-x, UPS, etc.) Plant Material, Weight",Record the weight in kilograms of plant material interceptions from express mail. Deactivation Note (BMiller) Code was changed to 6131BK with same Description.,NULL,0,2011-12-05 15:24:55.0000000,0,2006-09-22 11:12:13.0000000,12,1,0,1
1663,6132BD,Express Courier QMIs Dairy,"Record the number of Dairy intercepted in Express Courier (Fed-X, DHL, UPS, etc.), or ground courier.",NULL,0,2011-12-05 15:24:55.0000000,0,2006-09-22 11:12:38.0000000,12,1,1,1
1664,6132BE,Express Courier QMIs Equine,"Record the number of Equine intercepted in Express Courier (Fed-X, DHL, UPS, etc.), or ground courier.",NULL,0,2011-12-05 15:24:55.0000000,0,2006-09-22 11:12:58.0000000,12,1,1,1
1665,6132BP,Express Courier QMIs Poultry,"Record the number of Poultry intercepted in Express Courier (Fed-X, DHL, UPS, etc.), or ground courier.",NULL,0,2011-12-05 15:24:55.0000000,0,2006-09-22 11:13:17.0000000,12,1,1,1
1666,6132BR,Express Courier QMIs Ruminant,"Record the number of Ruminant intercepted in Express Courier (Fed-X, DHL, UPS, etc.), or ground courier.",NULL,0,2011-12-05 15:24:55.0000000,0,2006-09-22 11:13:39.0000000,12,1,1,1
1667,6132BS,Express Courier QMIs Swine,"Record the number of Swine intercepted in Express Courier (Fed-X, DHL, UPS, etc.), or ground courier.",NULL,0,2011-12-05 15:24:55.0000000,0,2006-09-22 11:13:58.0000000,12,1,1,1
1668,6133BD,Express Courier QMIs Dairy (KGS),"Record the weight of Dairy intercepted in kilograms from Express Courier (Fed-X, DHL, UPS, etc.), or ground courier.",NULL,0,2011-12-05 15:24:55.0000000,0,2006-09-22 11:14:20.0000000,12,1,1,1
1669,6133BE,Express Courier QMIs Equine (KGS),"Record the weight of Equine QMIs intercepted in kilograms from Express Courier (Fed-X, DHL, UPS, etc.), or ground courier.",NULL,0,2011-12-05 15:24:55.0000000,0,2006-09-22 11:14:47.0000000,12,1,1,1
1670,6133BP,Express Courier QMIIs Poultry (KGS),"Record the weight of Poultry intercepted in kilograms from Express Courier (Fed-X, DHL, UPS, etc.), or ground courier.",NULL,0,2011-12-05 15:24:55.0000000,0,2006-09-22 11:15:11.0000000,12,1,1,1
1671,6133BR,Express Courier QMIs Ruminant (KGS),"Record the weight of Ruminant intercepted in kilograms from Express Courier (Fed-X, DHL, UPS, etc.), or ground courier.",NULL,0,2011-12-05 15:24:55.0000000,0,2006-09-22 11:15:30.0000000,12,1,1,1
1672,6133BS,Express Courier QMIs Swine (KGS),"Record the weight of Swine intercepted in kilograms from Express Courier (Fed-X, DHL, UPS, etc.), or ground courier.",NULL,0,2011-12-05 15:24:54.0000000,0,2006-09-22 11:15:48.0000000,12,1,1,1
1673,6134BD,Express Courier QMIs Dairy Byproduct,"Record the number of inedible Dairy byproducts intercepted in Express Courier (Fed-X, DHL, UPS, etc.), or ground courier.",NULL,0,2011-12-05 15:24:55.0000000,0,2006-09-22 11:16:09.0000000,12,1,1,1
1674,6134BE,Express Courier QMIs Equine Byproduct,"Record the number of inedible Equine byproducts intercepted in Express Courier (Fed-X, DHL, UPS, etc.), or ground courier.",NULL,0,2011-12-05 15:24:55.0000000,0,2006-09-22 11:16:27.0000000,12,1,1,1
1675,6134BP,Express Courier QMIs Poultry Byproduct,"Record the number of inedible Poultry byproducts intercepted in Express Courier (Fed-X, DHL, UPS, etc.), or ground courier.",NULL,0,2011-12-05 15:24:55.0000000,0,2006-09-22 11:16:46.0000000,12,1,1,1
1676,6134BR,Express Courier QMIs Ruminant Byproduct,"Record the number of inedible Ruminant byproducts intercepted in Express Courier (Fed-X, DHL, UPS, etc.), or ground courier.",NULL,0,2011-12-05 15:24:54.0000000,0,2006-09-22 11:17:03.0000000,12,1,1,1
1677,6134BS,Express Courier QMIs Swine Byproduct,"Record the number of inedible Swine byproducts intercepted in Express Courier (Fed-X, DHL, UPS, etc.), or ground courier.",NULL,0,2011-12-05 15:24:55.0000000,0,2006-09-22 11:17:18.0000000,12,1,1,1
1678,6135BD,Express Courier QMIs Dairy Byproduct (KGS),"Record the weight of Dairy byproducts intercepted in kilograms from Express Courier (Fed-X, DHL, UPS, etc.), or ground courier.",NULL,0,2011-12-05 15:24:55.0000000,0,2006-09-22 11:17:34.0000000,12,1,1,1
1679,6135BE,Express Courier QMIs Equine Byproduct (KGS),"Record the weight of Equine byproducts intercepted in kilograms from Express Courier (Fed-X, DHL, UPS, etc.), or ground courier.",NULL,0,2011-12-05 15:24:55.0000000,0,2006-09-22 11:17:59.0000000,12,1,1,1
1680,6135BP,Express Courier QMIs Poultry Byproduct (KGS),"Record the weight of Poultry byproducts intercepted in kilograms from Express Courier (Fed-X, DHL, UPS, etc.), or ground courier.",NULL,0,2011-12-05 15:24:55.0000000,0,2006-09-22 11:18:16.0000000,12,1,1,1
1681,6135BR,Express Courier QMIs Ruminant Byproduct  (KGS),"Record the weight of Ruminant byproducts intercepted in kilograms from Express Courier (Fed-X, DHL, UPS, etc.), or ground courier.",NULL,0,2011-12-05 15:24:55.0000000,0,2006-09-22 11:18:36.0000000,12,1,1,1
1682,6135BS,Express Courier QMIs Swine Byproduct  (KGS),"Record the weight of Swine byproducts intercepted in kilograms from Express Courier (Fed-X, DHL, UPS, etc.), or ground courier.",NULL,0,2011-12-05 15:24:55.0000000,0,2006-09-22 11:18:55.0000000,12,1,1,1
1683,6136B,"Express Courier (FedEx, UPS, etc.) Quarantine Pest","Record the number of quarantine pests from Express Courier (Fed-X, DHL, UPS, etc.) interceptions for the month. This information is supplied by the identifiers.",NULL,0,2011-12-05 15:24:55.0000000,0,2025-02-22 04:36:40.0000000,12,1,1,1
1684,6150CD,Express Courier Reject-Commercial Dairy,"Record by AWB, House Bills, Manifest, or B/L the number of commercial Express Courier (Fed-X, DHL, UPS, etc.) Dairy shipments rejected by CBP as a result of SITC specific information.",NULL,0,2011-12-05 15:24:55.0000000,0,2006-09-22 11:19:40.0000000,12,1,1,1
1685,6150CE,Express Courier Reject-Commercial Equine,"Record by AWB, House Bills, Manifest, or B/L the number of commercial Express Courier (Fed-X, DHL, UPS, etc.) Equine shipments rejected by CBP as a result of SITC specific information.",NULL,0,2011-12-05 15:24:55.0000000,0,2006-09-22 11:19:57.0000000,12,1,1,1
1686,6150CP,Express Courier Reject-Commercial Poultry,"Record by AWB, House Bills, Manifest, or B/L the number of commercial Express Courier (Fed-X, DHL, UPS, etc.) Poultry shipments rejected by CBP as a result of SITC specific information.",NULL,0,2011-12-05 15:24:55.0000000,0,2006-09-22 11:20:41.0000000,12,1,1,1
1687,6150CR,Express Courier Reject-Commercial Ruminant,"Record by AWB, House Bills, Manifest, or B/L the number of commercial Express Courier (Fed-X, DHL, UPS, etc.) Ruminant shipments rejected by CBP as a result of SITC specific information.",NULL,0,2011-12-05 15:24:55.0000000,0,2006-09-22 11:21:00.0000000,12,1,1,1
1688,6150CS,Express Courier Reject-Commercial Swine,"Record by AWB, House Bills, Manifest, or B/L the number of commercial Express Courier (Fed-X, DHL, UPS, etc.) Swine shipments rejected by CBP as a result of SITC specific information.",NULL,0,2011-12-05 15:24:55.0000000,0,2006-09-22 11:21:17.0000000,12,1,1,1
1689,6151CD,Express Courier Reject-Commercial Dairy (KGS),"Record the weight in kilograms of commercial Express Courier (Fed-X, DHL, UPS, etc.) Dairy products rejected by CBP as a result of SITC specific information.",NULL,0,2011-12-05 15:24:55.0000000,0,2006-09-22 11:21:36.0000000,12,1,1,1
1690,6151CE,Express Courier Reject-Commercial Equine (KGS),"Record the weight in kilograms of commercial Express Courier (Fed-X, DHL, UPS, etc.) Equine products rejected by CBP as a result of SITC specific information.",NULL,0,2011-12-05 15:24:55.0000000,0,2006-09-22 11:21:54.0000000,12,1,1,1
1691,6151CP,Express Courier Reject-Commercial Poultry (KGS),"Record the weight in kilograms of commercial Express Courier (Fed-X, DHL, UPS, etc.) Poultry products rejected by CBP as a result of SITC specific information.",NULL,0,2011-12-05 15:24:55.0000000,0,2006-09-22 11:22:12.0000000,12,1,1,1
1692,6151CR,Express Courier Reject-Commercial Ruminant (KGS),"Record the weight in kilograms of commercial Express Courier (Fed-X, DHL, UPS, etc.) Ruminant products rejected by CBP as a result of SITC specific information.",NULL,0,2011-12-05 15:24:55.0000000,0,2006-09-22 11:22:37.0000000,12,1,1,1
1693,6151CS,Express Courier Reject-Commercial Swine (KGS),"Record the weight in kilograms of commercial Express Courier (Fed-X, DHL, UPS, etc.) Swine products rejected by CBP as a result of SITC specific information.",NULL,0,2011-12-05 15:24:55.0000000,0,2006-09-22 11:23:04.0000000,12,1,1,1
1694,6157CD,Express Courier Reject-Commercial Dairy Byproduct,"Record by AWB, House Bills, Manifest, or B/L the number of commercial Express Courier (Fed-X, DHL, UPS, etc.) inedible Dairy byproduct shipments rejected by CBP as a result of SITC specific information.",NULL,0,2011-12-05 15:24:55.0000000,0,2006-09-22 11:23:21.0000000,12,1,1,1
1695,6157CE,Express Courier Reject-Commercial Equine Byproduct,"Record by AWB, House Bills, Manifest, or B/L the number of commercial Express Courier (Fed-X, DHL, UPS, etc.) inedible Equine byproduct shipments rejected by CBP as a result of SITC specific information.",NULL,0,2011-12-05 15:24:55.0000000,0,2006-09-22 11:23:39.0000000,12,1,1,1
1696,6157CP,Express Courier Reject-Commercial Poultry Byproduct,"Record by AWB, House Bills, Manifest, or B/L the number of commercial Express Courier (Fed-X, DHL, UPS, etc.) inedible Poultry byproduct shipments rejected by CBP as a result of SITC specific information.",NULL,0,2011-12-05 15:24:55.0000000,0,2006-09-22 11:24:01.0000000,12,1,1,1
1697,6157CR,Express Courier Reject-Commercial Ruminant Byproduct,"Record by AWB, House Bills, Manifest, or B/L the number of commercial Express Courier (Fed-X, DHL, UPS, etc.) inedible Ruminant byproduct shipments rejected by CBP as a result of SITC specific information.",NULL,0,2011-12-05 15:24:55.0000000,0,2006-09-22 11:24:20.0000000,12,1,1,1
1698,6157CS,Express Courier Reject-Commercial Swine Byproduct,"Record by AWB, House Bills, Manifest, or B/L the number of commercial Express Courier (Fed-X, DHL, UPS, etc.) inedible Swine byproduct shipments rejected by CBP as a result of SITC specific information.",NULL,0,2011-12-05 15:24:55.0000000,0,2006-09-22 11:24:37.0000000,12,1,1,1
1699,6158CD,Express Courier Reject-Commercial Dairy Byproduct (KGS),"Record the weight in kilograms of commercial Express Courier (Fed-X, DHL, UPS, etc.) inedible Dairy byproduct shipments rejected by CBP as a result of SITC specific information.",NULL,0,2011-12-05 15:24:55.0000000,0,2006-09-22 11:24:55.0000000,12,1,1,1
1700,6158CE,Express Courier Reject-Commercial Equine Byproduct (KGS),"Record the weight in kilograms of commercial Express Courier (Fed-X, DHL, UPS, etc.) inedible Equine byproduct shipments rejected by CBP as a result of SITC specific information.",NULL,0,2011-12-05 15:24:55.0000000,0,2006-09-22 11:25:19.0000000,12,1,1,1
1701,6158CP,Express Courier Reject-Commercial Poultry Byproduct (KGS),"Record the weight in kilograms of commercial Express Courier (Fed-X, DHL, UPS, etc.) inedible Poultry byproduct shipments rejected by CBP as a result of SITC specific information.",NULL,0,2011-12-05 15:24:55.0000000,0,2006-09-22 11:25:36.0000000,12,1,1,1
1702,6158CR,Express Courier Reject-Commercial Ruminant Byproduct  (KGS),"Record the weight in kilograms of commercial Express Courier (Fed-X, DHL, UPS, etc.) inedible Ruminant byproduct shipments rejected by CBP as a result of SITC specific information.",NULL,0,2011-12-05 15:24:55.0000000,0,2006-09-22 11:25:53.0000000,12,1,1,1
1703,6158CS,Express Courier Reject-Commercial Swine Byproduct  (KGS),"Record the weight in kilograms of commercial Express Courier (Fed-X, DHL, UPS, etc.) inedible Swine byproduct shipments rejected by CBP as a result of SITC specific information.",NULL,0,2011-12-05 15:24:55.0000000,0,2006-09-22 11:26:23.0000000,12,1,1,1
1704,7130B,"O/T Express Courier (Fed-x, UPS, etc.) Packages Verified",Record the number of Overtime Express Carrier packages verified (physically opened) by SITC. Do not include packages which have been X-rayed or screened by K-9.,NULL,0,2011-12-05 15:24:55.0000000,0,2006-09-22 11:26:43.0000000,12,1,1,1
1705,6170,Inland Reviews,"Record the number of inland paper reviews, regulated and miscellaneous, performed on cargo by bill of lading (during both overtime and regular hours of service). This category will include all bills of lading which required only paperwork to complete the review or treatment is required. Physical verifications may be performed on the cargo, but only to satisfy the conditions of entry.",NULL,0,2011-12-05 15:24:54.0000000,0,2006-09-22 11:27:02.0000000,12,1,1,1
